{
"$schema":"https://json-schema.org/draft/2020-12/schema",
"$id":"https://spec-driven.local/format/v2/source-ledger.schema.json",
"type":"object",
"additionalProperties":false,
"required":["version","normalization","crosswalk","items","summary"],
"properties":{"version":{"const":1,"type":"integer"},"normalization":{"type":"string","minLength":1,"const":"nfc-lf-trim-trailing-v1","x-spec-ref":false,"x-spec-exclusion":{"category":"enum-literal"}},"crosswalk":{"type":"string","minLength":1,"pattern":"^(?!/)(?!.*(?:^|/)\\.\\.(?:/|$))(?!.*\\\\)(?!.*:)[^\\s#]+$","x-spec-ref":"source-ledger-crosswalk"},"items":{"type":"array","minItems":1,"items":{"type":"object","additionalProperties":false,"required":["id","source","text_sha256","status","mappings"],"properties":{"id":{"type":"string","minLength":1,"pattern":"^[A-Za-z0-9][A-Za-z0-9_.-]*$","x-spec-ref":"source-ledger-item-id"},"source":{"type":"object","additionalProperties":false,"required":["file","line"],"properties":{"file":{"type":"string","minLength":1,"pattern":"^(?!/)(?!.*(?:^|/)\\.\\.(?:/|$))(?!.*\\\\)(?!.*:)[^\\s#]+$","x-spec-ref":"source-ledger-source-file"},"line":{"type":"integer","minimum":1}}},"text_sha256":{"type":"string","minLength":1,"pattern":"^[a-f0-9]{64}$","x-spec-ref":false,"x-spec-exclusion":{"category":"regex"}},"status":{"type":"string","minLength":1,"enum":["exact","partial","conflicting","no-demo"],"x-spec-ref":false,"x-spec-exclusion":{"category":"enum-literal"}},"mappings":{"type":"array","minItems":0,"items":{"type":"object","additionalProperties":false,"required":["kind","id"],"properties":{"kind":{"type":"string","minLength":1,"enum":["contract","req","us","ac","scenario","screen-state","board","component","pattern","token","rule","test","fixture","environment","build","artifact","gate","receipt","amendment","decision"],"x-spec-ref":false,"x-spec-exclusion":{"category":"enum-literal"}},"id":{"type":"string","minLength":1,"pattern":"^(?:contract|req|us|ac|scenario|screen-state|board|component|pattern|token|rule|test|fixture|environment|build|artifact|gate|receipt|amendment|decision):[^\\s]+$","x-spec-ref":"source-ledger-mapping-id"}}}},"reason":{"type":"string","minLength":1,"pattern":"\\S","x-spec-ref":false,"x-spec-exclusion":{"category":"free-text"}},"crosswalk_row":{"type":"string","minLength":1,"pattern":"^CW-[0-9]+$","x-spec-ref":"source-ledger-crosswalk-row"}},"allOf":[{"if":{"type":"object","required":["status"],"properties":{"status":{"const":"exact","x-spec-ref":false,"x-spec-exclusion":{"category":"refinement-of","owner":"source-ledger.schema.json#/properties/items/items/properties/status"}}}},"then":{"type":"object","required":["mappings"],"properties":{"mappings":{"type":"array","minItems":1,"x-spec-ref":false,"x-spec-exclusion":{"category":"refinement-of","owner":"source-ledger.schema.json#/properties/items/items/properties/mappings"}}}},"x-spec-ref":false,"x-spec-exclusion":{"category":"refinement-of","owner":"source-ledger.schema.json#/properties/items/items"}},{"if":{"type":"object","required":["status"],"properties":{"status":{"enum":["partial","conflicting","no-demo"],"x-spec-ref":false,"x-spec-exclusion":{"category":"refinement-of","owner":"source-ledger.schema.json#/properties/items/items/properties/status"}}}},"then":{"type":"object","required":["reason"],"properties":{"reason":{"type":"string","minLength":1,"pattern":"\\S","x-spec-ref":false,"x-spec-exclusion":{"category":"refinement-of","owner":"source-ledger.schema.json#/properties/items/items/properties/reason"}}}},"x-spec-ref":false,"x-spec-exclusion":{"category":"refinement-of","owner":"source-ledger.schema.json#/properties/items/items"}},{"if":{"type":"object","required":["status"],"properties":{"status":{"const":"no-demo","x-spec-ref":false,"x-spec-exclusion":{"category":"refinement-of","owner":"source-ledger.schema.json#/properties/items/items/properties/status"}}}},"then":{"type":"object","required":["mappings"],"properties":{"mappings":{"type":"array","maxItems":0,"x-spec-ref":false,"x-spec-exclusion":{"category":"refinement-of","owner":"source-ledger.schema.json#/properties/items/items/properties/mappings"}}}},"else":{"type":"object","required":["mappings"],"properties":{"mappings":{"type":"array","minItems":1,"x-spec-ref":false,"x-spec-exclusion":{"category":"refinement-of","owner":"source-ledger.schema.json#/properties/items/items/properties/mappings"}}}},"x-spec-ref":false,"x-spec-exclusion":{"category":"refinement-of","owner":"source-ledger.schema.json#/properties/items/items"}}]}},"summary":{"type":"object","additionalProperties":false,"required":["source_preservation","typed_coverage","demo_coverage"],"properties":{"source_preservation":{"type":"object","additionalProperties":false,"required":["total","preserved"],"properties":{"total":{"type":"integer","minimum":0},"preserved":{"type":"integer","minimum":0}}},"typed_coverage":{"type":"object","additionalProperties":false,"required":["total","mapped"],"properties":{"total":{"type":"integer","minimum":0},"mapped":{"type":"integer","minimum":0}}},"demo_coverage":{"type":"object","additionalProperties":false,"required":["total","passed"],"properties":{"total":{"type":"integer","minimum":0},"passed":{"type":"integer","minimum":0}}}}}}
}
